{
  "browseResultId": "99999999-9999-4999-8999-999999999999",
  "commandId": "11111111-1111-4111-8111-111111111113",
  "roomId": "22222222-2222-4222-8222-222222222222",
  "deviceId": "33333333-3333-4333-8333-333333333333",
  "schemaVersion": 1,
  "createdAt": "2026-07-11T09:02:01Z",
  "status": "completed",
  "relativePath": "documents",
  "nextCursor": null,
  "entries": [
    {
      "name": "note.md",
      "relativePath": "documents/note.md",
      "kind": "file",
      "sizeBytes": 1024,
      "modifiedUnixMs": 1783760400000
    },
    {
      "name": "reports",
      "relativePath": "documents/reports",
      "kind": "directory",
      "sizeBytes": null,
      "modifiedUnixMs": 1783760400000
    }
  ]
}
